{
  "schemaVersion": "1.0.0",
  "runId": "gpt-5-terra__openrouter__2026-09-10",
  "benchmarkVersion": "1.0.0-draft",
  "createdAt": "2026-09-10T22:33:02.307Z",
  "model": {
    "id": "openai/gpt-5.6-terra",
    "provider": "openrouter",
    "harness": "OpenCode 1.18.30",
    "reasoning": "high"
  },
  "resultStatus": "COMPLETE",
  "terminationReason": "completed",
  "score": {
    "earned": 100,
    "maximum": 100
  },
  "timing": {
    "startedAt": "2026-09-10T22:29:03.840Z",
    "endedAt": "2026-09-10T22:33:02.307Z",
    "buildTotalMs": 238467,
    "evaluationTotalMs": 20703
  },
  "cost": {
    "currency": "USD",
    "participant": 0.5065859,
    "limit": 8,
    "source": "OpenCode session export / OpenRouter"
  },
  "usage": {
    "turns": 24,
    "toolCalls": 27,
    "tokens": {
      "input": 69,
      "output": 19083,
      "reasoning": 3503,
      "cached": 665870
    }
  },
  "checks": [
    {
      "id": "setup.install",
      "status": "passed",
      "pointsAvailable": 2,
      "pointsAwarded": 2,
      "summary": "As dependências foram instaladas sem flags de contorno.",
      "evidence": "npm install concluiu em 5304 ms com a stack obrigatória."
    },
    {
      "id": "setup.database",
      "status": "passed",
      "pointsAvailable": 3,
      "pointsAwarded": 3,
      "summary": "O banco foi recriado duas vezes com o seed correto.",
      "evidence": "db:setup recriou duas vezes o banco isolado indicado por DB_PATH."
    },
    {
      "id": "setup.build",
      "status": "passed",
      "pointsAvailable": 4,
      "pointsAwarded": 4,
      "summary": "O frontend e o servidor foram compilados para produção.",
      "evidence": "O build de produção concluiu em 3745 ms."
    },
    {
      "id": "setup.start",
      "status": "passed",
      "pointsAvailable": 5,
      "pointsAwarded": 5,
      "summary": "A aplicação iniciou e serviu API e interface na mesma origem.",
      "evidence": "npm start serviu a API e a interface na mesma origem."
    },
    {
      "id": "clients.create",
      "status": "passed",
      "pointsAvailable": 5,
      "pointsAwarded": 5,
      "summary": "Um cliente válido foi criado e persistido.",
      "evidence": "Cliente 6 foi criado com campos normalizados e timestamps válidos."
    },
    {
      "id": "clients.read",
      "status": "passed",
      "pointsAvailable": 4,
      "pointsAwarded": 4,
      "summary": "A listagem, a busca e a paginação de clientes refletiram o banco.",
      "evidence": "Listagem, busca case-insensitive e páginas de clientes refletiram o banco."
    },
    {
      "id": "clients.update",
      "status": "passed",
      "pointsAvailable": 4,
      "pointsAwarded": 4,
      "summary": "A atualização parcial preservou os demais campos.",
      "evidence": "A edição parcial mudou o nome, preservou o e-mail e atualizou o timestamp."
    },
    {
      "id": "clients.delete",
      "status": "passed",
      "pointsAvailable": 5,
      "pointsAwarded": 5,
      "summary": "A exclusão funcionou sem corromper negócios relacionados.",
      "evidence": "Cliente sem vínculo foi excluído; cliente com negócio recebeu 409 sem cascata."
    },
    {
      "id": "deals.create",
      "status": "passed",
      "pointsAvailable": 6,
      "pointsAwarded": 6,
      "summary": "Um negócio válido foi criado e ligado ao cliente correto.",
      "evidence": "Negócio 9 foi criado e ligado ao cliente 6."
    },
    {
      "id": "deals.read",
      "status": "passed",
      "pointsAvailable": 4,
      "pointsAwarded": 4,
      "summary": "A listagem, a busca, os filtros e a paginação de negócios refletiram o banco.",
      "evidence": "Listagem, busca, filtros combinados e paginação de negócios refletiram o banco."
    },
    {
      "id": "deals.update",
      "status": "passed",
      "pointsAvailable": 5,
      "pointsAwarded": 5,
      "summary": "A atualização parcial do negócio persistiu corretamente.",
      "evidence": "A edição parcial persistiu a etapa e preservou os demais campos."
    },
    {
      "id": "deals.delete",
      "status": "passed",
      "pointsAvailable": 4,
      "pointsAwarded": 4,
      "summary": "O negócio solicitado foi excluído sem afetar outros dados.",
      "evidence": "O negócio solicitado foi excluído sem remover clientes ou outros dados."
    },
    {
      "id": "deals.validation",
      "status": "passed",
      "pointsAvailable": 4,
      "pointsAwarded": 4,
      "summary": "Dados e relacionamentos inválidos foram recusados.",
      "evidence": "Título, valor, etapa e relacionamento inválidos foram recusados sem gravação parcial."
    },
    {
      "id": "metrics.accuracy",
      "status": "passed",
      "pointsAvailable": 8,
      "pointsAwarded": 8,
      "summary": "Os indicadores acompanharam exatamente os dados persistidos.",
      "evidence": "Os indicadores conferiram antes e depois de criar, fechar e excluir um negócio."
    },
    {
      "id": "pipeline.render",
      "status": "passed",
      "pointsAvailable": 6,
      "pointsAwarded": 6,
      "summary": "As quatro etapas e seus cartões apareceram na ordem correta.",
      "evidence": "As quatro etapas, na ordem correta, exibiram todos os negócios persistidos."
    },
    {
      "id": "pipeline.persistence",
      "status": "passed",
      "pointsAvailable": 6,
      "pointsAwarded": 6,
      "summary": "A nova etapa permaneceu salva após reiniciar o servidor.",
      "evidence": "A etapa mudou pela interface e permaneceu no SQLite após reiniciar o servidor."
    },
    {
      "id": "pipeline.drag_drop",
      "status": "passed",
      "pointsAvailable": 5,
      "pointsAwarded": 5,
      "summary": "Um cartão pôde ser arrastado e permaneceu na nova etapa.",
      "evidence": "O cartão foi arrastado e permaneceu na nova coluna após reiniciar o servidor."
    },
    {
      "id": "ui.client_flow",
      "status": "passed",
      "pointsAvailable": 5,
      "pointsAwarded": 5,
      "summary": "CRUD, busca, paginação visível de 4 itens e visualização dos negócios do cliente funcionaram.",
      "evidence": "Paginação, busca, negócios relacionados e CRUD de clientes funcionaram pela interface."
    },
    {
      "id": "ui.deal_flow",
      "status": "passed",
      "pointsAvailable": 5,
      "pointsAwarded": 5,
      "summary": "CRUD, busca, filtros e paginação visível de 4 itens funcionaram pela interface.",
      "evidence": "Paginação, busca, filtros combinados e CRUD de negócios funcionaram pela interface."
    },
    {
      "id": "ui.feedback",
      "status": "passed",
      "pointsAvailable": 4,
      "pointsAwarded": 4,
      "summary": "Erros e estados foram visíveis e a interface respondeu bem no celular.",
      "evidence": "Erro, sucesso, confirmação e estado vazio ficaram visíveis, sem overflow nas duas viewports."
    },
    {
      "id": "ui.app_name",
      "status": "passed",
      "pointsAvailable": 1,
      "pointsAwarded": 1,
      "summary": "O produto foi identificado como CRMBench Modelo.",
      "evidence": "O título do navegador e a marca visível usam CRMBench Modelo."
    },
    {
      "id": "quality.tests_docs",
      "status": "passed",
      "pointsAvailable": 5,
      "pointsAwarded": 5,
      "summary": "Os testes essenciais passaram e o README explicou os comandos.",
      "evidence": "4 testes passaram e o README documentou os cinco comandos obrigatórios."
    }
  ],
  "links": {
    "report": "./report.md",
    "video": null,
    "project": "./project"
  }
}
